Listings,Price,Room Type,Reviews,Location
Stylish Flat with Stunning Rooftop,259,Entire home/apt,1,"Williamsburg, Brooklyn"
Quiet apartment in lovely area,100,Entire home/apt,4,"Boerum Hill, Brooklyn"
"Lovely, cozy loft Carroll Gardens",129,Entire home/apt,8,"Gowanus, Brooklyn"
Huge Apt w/Yard near Williamsburg,195,Entire home/apt,4,"Greenpoint, Brooklyn"
"Fantastic, Affordable Rooftop Spot",64,Private room,6,"Bushwick, Brooklyn"
"Big, Bright, Beautiful Brooklyn Apt",300,Entire home/apt,4,"Williamsburg, Brooklyn"
Chic private apartment in townhouse,159,Entire home/apt,1,"Clinton Hill, Brooklyn"
Private 1-bedroom with sofa bed,130,Entire home/apt,6,"Bedford-Stuyvesant, Brooklyn"
"Dreamy room, eclectic Bushwick apt",35,Private room,1,"Bushwick, Brooklyn"
Spacious 2 BD in Quiet NBRHD,150,Entire home/apt,1,"Bedford-Stuyvesant, Brooklyn"
Warm modern Park Slope townhouse,325,Entire home/apt,4,"Park Slope, Brooklyn"
East Williamsburg Artist Loft,50,Private room,2,"Williamsburg, Brooklyn"
Cozy Top Floor Room of Brownstone,75,Private room,5,"Park Slope, Brooklyn"
Private bedroom in awesome loft apt,75,Private room,1,"Williamsburg, Brooklyn"
PRIME 1br in Williamsburg,135,Entire home/apt,5,"Williamsburg, Brooklyn"
CHARMING SANCTUARY/sleeps3/BARGAIN!,129,Entire home/apt,3,"Fort Greene, Brooklyn"
Private Room 3- Amazing Wberg Flat,75,Private room,2,"Williamsburg, Brooklyn"
Sunny & Spacious in Park Slope,200,Entire home/apt,1,"Park Slope, Brooklyn"
Cool area! Five minutes to metro!,80,Private room,8,"Williamsburg, Brooklyn"
Charming Private Bedroom—50% OFF,110,Private room,3,"Park Slope, Brooklyn"
Room in beautiful friendly house,55,Private room,1,"Bushwick, Brooklyn"
It's all about Bushwick BROOKLYN,100,Entire home/apt,7,"Bushwick, Brooklyn"
Vibrant Artist's Guest Studio Apt.,130,Entire home/apt,2,"Greenpoint, Brooklyn"
